<?xml version="1.0" encoding="UTF-8"?>

<!ELEMENT libros (libro+)>
<!ELEMENT libro (titulo,autor)>
<!ELEMENT autor (#PCDATA)>
<!ELEMENT titulo (#PCDATA)>
